{
  "version": "1.0.0",
  "id": "dsc_7e14a8d8-2f74-4f5a-9e16-5bdb5c6c8b7f",
  "created_at": "2026-01-13T12:00:00Z",
  "template": {
    "slug": "article",
    "version": "1.0.0"
  },
  "project": {
    "title": "How I Built Disclose",
    "author": "aislop",
    "links": [
      "https://example.com/post"
    ],
    "audience": "public"
  },
  "ai_tools": [
    {
      "name": "ChatGPT",
      "provider": "OpenAI",
      "model": "GPT-5.2 Pro",
      "notes": "Idea exploration + proofreading"
    },
    {
      "name": "Claude",
      "provider": "Anthropic",
      "model": "Opus 4.5",
      "notes": "Outline feedback"
    }
  ],
  "assistance": {
    "global": {
      "human_percent": 75,
      "ai_percent": 25
    },
    "stages": [
      {
        "key": "research",
        "label": "Research",
        "grade": "light",
        "approx_ai_percent": 10
      },
      {
        "key": "drafting",
        "label": "Drafting",
        "grade": "moderate",
        "approx_ai_percent": 30
      },
      {
        "key": "editing",
        "label": "Editing",
        "grade": "light",
        "approx_ai_percent": 10
      }
    ],
    "notes": "All final claims were verified manually."
  },
  "proof": {
    "items": [
      {
        "id": "p1",
        "label": "Raw notes",
        "kind": "file",
        "path": "notes.md",
        "mime": "text/markdown",
        "size_bytes": 8421,
        "sha256": "0000000000000000000000000000000000000000000000000000000000000000",
        "created_before_ai": true,
        "notes": "Early brainstorming notes."
      },
      {
        "id": "p2",
        "label": "Voice memo explaining structure",
        "kind": "file",
        "path": "memo.m4a",
        "mime": "audio/mp4",
        "size_bytes": 2183921,
        "sha256": "1111111111111111111111111111111111111111111111111111111111111111",
        "created_before_ai": true
      }
    ],
    "bundle_root_sha256": "2222222222222222222222222222222222222222222222222222222222222222"
  },
  "timestamps": {
    "opentimestamps": {
      "enabled": true,
      "status": "pending",
      "receipt_sha256": "3333333333333333333333333333333333333333333333333333333333333333",
      "receipt_filename": "bundle-root.ots"
    }
  }
}
